product_id,title,category,current_price,price_segment,rating_score,review_count,total_sold,gender,image_url
JYSK_0011,kệ treo tường terp gỗ công nghiệp màu sồi rộng 80 sâu 24 cao 4cm,home decor,479200,phân khúc phổ thông,4.7,40,269,,https://jysk.vn/media/catalog/product/cache/2d1b3214b9b1ef59564a4bebf2c14d80/3/6/3630108-ke-treo-tuong-terp-mau-soi-jysk.jpg
JYSK_0012,kệ treo tường trappedal kim loại gỗ công nghiệp đen sồi rộng 50 25 sâu 20 20 cao 35 35cm,home decor,559200,phân khúc trung cấp,4.2,4,34,,https://jysk.vn/media/catalog/product/cache/2d1b3214b9b1ef59564a4bebf2c14d80/3/6/3690171-ke-treo-tuong-trappedal-den-soi-jysk-1.jpg
JYSK_0013,kệ treo tường bộ 3 chiếc stenum kim loại nhiều màu,home decor,639200,phân khúc trung cấp,4.7,13,126,,https://jysk.vn/media/catalog/product/cache/2d1b3214b9b1ef59564a4bebf2c14d80/3/6/3650240-ke-treo-tuong-bo-3-chiec-stenum-kim-loai-jysk-2.jpg
JYSK_0014,kệ treo tường bộ 3 chiếc ilbro gỗ công nghiệp trắng sồi rộng 39 sâu 15 cao 34 rộng 35 sâu 14 cao 31 rộng 31 sâu 13 cao 27cm,home decor,719200,phân khúc trung cấp,4.4,4,37,,https://jysk.vn/media/catalog/product/cache/2d1b3214b9b1ef59564a4bebf2c14d80/3/6/3600035-ke-treo-tuong-bo-3-chiec-ilbro-trang-soi-jysk-1.jpg
JYSK_0015,kệ treo tường karstoft gỗ công nghiệp trắng rộng 40 sâu 13 cao 80cm,home decor,719200,phân khúc trung cấp,4.8,13,392,,https://jysk.vn/media/catalog/product/cache/2d1b3214b9b1ef59564a4bebf2c14d80/3/6/3630059-ke-treo-tuong-karstoft-trang-jysk.jpg
JYSK_0016,kệ sách 4 ngăn astrup kim loại gỗ công nghiệp đen rộng 59 sâu 24 cao 112cm,home decor,792000,phân khúc trung cấp,4.6,51,358,,https://jysk.vn/media/catalog/product/cache/2d1b3214b9b1ef59564a4bebf2c14d80/3/6/3650042-ke-trung-bay-4-ngan-astrup-den-jysk-1.jpg
JYSK_0017,kệ treo tường borum gỗ công nghiệp màu sồi rộng 40 sâu 15 cao 92cm,home decor,799200,phân khúc trung cấp,4.4,9,15,,https://jysk.vn/media/catalog/product/cache/2d1b3214b9b1ef59564a4bebf2c14d80/3/6/3650048-ke-treo-tuong-borum-mau-soi-jysk-1.jpg
JYSK_0018,kệ treo tường allested gỗ công nghiệp trắng sồi rộng 110 sâu 20 cao 40cm,home decor,1032000,phân khúc trung cấp,4.2,3,26,,https://jysk.vn/media/catalog/product/cache/2d1b3214b9b1ef59564a4bebf2c14d80/3/6/3650097-ke-treo-tuong-allested-trang-soi-jysk-1.jpg
JYSK_0019,kệ treo tường hirtshals kim loại gỗ công nghiệp hồng rộng 51 sâu 22 cao 68cm,home decor,1039200,phân khúc trung cấp,4.4,9,11,,https://jysk.vn/media/catalog/product/cache/2d1b3214b9b1ef59564a4bebf2c14d80/3/6/3600260-ke-treo-tuong-hirtshals-hong-jysk-21.jpg
JYSK_0020,kệ sách 3 tầng vandborg gỗ công nghiệp kim loại be màu sồi rộng 80 sâu 40 cao 92cm,home decor,1192000,phân khúc trung cấp,4.9,32,64,,https://jysk.vn/media/catalog/product/cache/2d1b3214b9b1ef59564a4bebf2c14d80/3/6/3630045-ke-sach-3-tang-vandborg-be-mau-soi-jysk.jpg
JYSK_0021,kệ sách 3 tầng vandborg gỗ công nghiệp kim loại đen sồi rộng 80 sâu 40 cao 92cm,home decor,1192000,phân khúc trung cấp,4.2,7,42,,https://jysk.vn/media/catalog/product/cache/2d1b3214b9b1ef59564a4bebf2c14d80/3/6/3621054-ke-sach-3-tang-vandborg-den-soi-jysk-1.jpg
JYSK_0022,kệ sách 6 ngăn astrup kim loại gỗ công nghiệp đen rộng 59 sâu 24 cao 176cm,home decor,1192000,phân khúc trung cấp,4.6,46,180,,https://jysk.vn/media/catalog/product/cache/2d1b3214b9b1ef59564a4bebf2c14d80/3/6/3650043-ke-trung-bay-6-ngan-astrup-den-jysk-1.jpg
JYSK_0023,kệ trang trí virum kim loại be rộng 80 sâu 26 cao 81cm,home decor,1192000,phân khúc trung cấp,4.7,92,195,,https://jysk.vn/media/catalog/product/cache/2d1b3214b9b1ef59564a4bebf2c14d80/3/6/3650200-ke-trang-tri-virum-be-jysk-1.jpg
JYSK_0024,kệ treo tường alken gỗ công nghiệp gỗ bạch dương xám rộng 60 sâu 17 cao 88cm,home decor,1199200,phân khúc trung cấp,5.0,84,414,,https://jysk.vn/media/catalog/product/cache/2d1b3214b9b1ef59564a4bebf2c14d80/3/6/3670075-ke-treo-tuong-alken-xam-jysk-1.jpg
JYSK_0025,kệ sách 3 tầng horsens gỗ công nghiệp trắng rộng 70 sâu 29 cao 120cm,home decor,1352000,phân khúc trung cấp,4.6,89,129,,https://jysk.vn/media/catalog/product/cache/2d1b3214b9b1ef59564a4bebf2c14d80/3/6/3606825-ke-sach-3-tang-horsens-trang-jysk-1.jpg
JYSK_0026,kệ sách 3 tầng herning gỗ công nghiệp trắng rộng 64 sâu 36 cao 95cm,home decor,1520000,phân khúc trung cấp,4.8,14,73,,https://jysk.vn/media/catalog/product/cache/2d1b3214b9b1ef59564a4bebf2c14d80/3/6/3688601-ke-sach-3-tang-herning-trang-jysk-1.jpg
JYSK_0027,kệ sách 5 tầng horsens gỗ công nghiệp màu sồi rộng 70 sâu 29 cao 197cm,home decor,1992000,phân khúc trung cấp,4.7,42,469,,https://jysk.vn/media/catalog/product/cache/2d1b3214b9b1ef59564a4bebf2c14d80/3/6/3640339-ke-sach-5-tang-horsens-mau-soi-jysk.jpg
JYSK_0028,kệ sách 5 tầng vandborg gỗ công nghiệp kim loại be màu sồi rộng 80 sâu 40 cao 166cm,home decor,1992000,phân khúc trung cấp,4.8,50,107,,https://jysk.vn/media/catalog/product/cache/2d1b3214b9b1ef59564a4bebf2c14d80/3/6/3630046-ke-sach-5-tang-vandborg-be-mau-soi-jysk.jpg
JYSK_0029,kệ sách 5 tầng vandborg gỗ công nghiệp kim loại đen sồi rộng 80 sâu 40 cao 164cm,home decor,1992000,phân khúc trung cấp,4.4,3,39,,https://jysk.vn/media/catalog/product/cache/2d1b3214b9b1ef59564a4bebf2c14d80/3/6/3621055-ke-sach-5-tang-vandborg-den-soi-jysk.jpg
JYSK_0030,kệ sách 5 tầng herning gỗ công nghiệp trắng rộng 64 sâu 36 cao 170cm,home decor,2320000,phân khúc cận cao cấp,4.5,10,294,,https://jysk.vn/media/catalog/product/cache/2d1b3214b9b1ef59564a4bebf2c14d80/3/6/3689801-ke-sach-5-tang-herning-trang-jysk-1.jpg
JYSK_0031,bàn trang trí trappedal gỗ công nghiệp kim loại màu sồi đen dài 80 sâu 30 cao 81cm,home decor,2392000,phân khúc cận cao cấp,4.7,29,226,,https://jysk.vn/media/catalog/product/cache/2d1b3214b9b1ef59564a4bebf2c14d80/3/6/3650156-ban-trang-tri-trappedal-mau-soi-den-jysk.jpg
JYSK_0032,kệ sách 5 tầng trappedal kim loại gỗ công nghiệp đen sồi rộng 70 sâu 30 cao 109cm,home decor,2392000,phân khúc cận cao cấp,4.1,2,21,,https://jysk.vn/media/catalog/product/cache/2d1b3214b9b1ef59564a4bebf2c14d80/3/6/3600987-ke-sach-5-tang-trappedal-den-soi-jysk.jpg
JYSK_0033,kệ sách 4 tầng lindved kim loại gỗ công nghiệp màu sồi rộng 80 sâu 41 cao 118cm,home decor,2792000,phân khúc cận cao cấp,4.2,10,3,,https://jysk.vn/media/catalog/product/cache/2d1b3214b9b1ef59564a4bebf2c14d80/3/6/3650068-ke-trung-bay-4-ngan-lindved-mau-soi-jysk-1.jpg
JYSK_0034,bàn trang điểm kèm gương saksild tre mdf gương màu tự nhiên rộng 80 sâu 35 cao 137cm,home decor,3592000,phân khúc cận cao cấp,4.1,2,9,,https://jysk.vn/media/catalog/product/cache/2d1b3214b9b1ef59564a4bebf2c14d80/3/6/3600330-ban-trang-diem-kem-guong-saksild-mau-tu-nhien-jysk-1.jpg
JYSK_0035,kệ sách 5 tầng mosbjerg gỗ công nghiệp màu sồi rộng 70 sâu 29 cao 190cm,home decor,3592000,phân khúc cận cao cấp,3.9,3,23,,https://jysk.vn/media/catalog/product/cache/2d1b3214b9b1ef59564a4bebf2c14d80/3/6/3640337-ke-sach-5-tang-mosbjerg-mau-soi-jysk.jpg
JYSK_0036,kệ sách 6 tầng vindinge nhựa thép màu chrome rộng 90 sâu 36 cao 180cm,home decor,3592000,phân khúc cận cao cấp,3.9,5,44,,https://jysk.vn/media/catalog/product/cache/2d1b3214b9b1ef59564a4bebf2c14d80/3/6/3605020-ke-sach-6-tang-vindinge-mau-chrome-jysk-6.jpg
JYSK_0037,kệ sách billund gỗ công nghiệp trắng xám rộng 80 sâu 33 cao 160cm,home decor,4720000,phân khúc cận cao cấp,4.8,47,252,,https://jysk.vn/media/catalog/product/cache/2d1b3214b9b1ef59564a4bebf2c14d80/3/6/3699036-ke-sach-billund-trang-xam-jysk-1.jpg
JYSK_0038,kệ sách 3 hộc billund gỗ công nghiệp trắng xám rộng 90 sâu 40 cao 140cm,home decor,5200000,phân khúc cận cao cấp,4.3,5,41,,https://jysk.vn/media/catalog/product/cache/2d1b3214b9b1ef59564a4bebf2c14d80/3/6/3681962-ke-sach-3-hoc-billund-trang-xam-jysk-1.jpg
JYSK_0039,bàn laptop mern gỗ công nghiệp kim loại đen rộng 34 dài 60 cao 23 27cm,home decor,349300,phân khúc phổ thông,4.4,8,4,,https://jysk.vn/media/catalog/product/cache/2d1b3214b9b1ef59564a4bebf2c14d80/3/6/363510486-ban-laptop-mern-den-jysk-12.jpg
JYSK_0040,bàn làm việc vandborg gỗ công nghiệp kim loại be rộng 60 dài 120 cao 75cm,home decor,1192000,phân khúc trung cấp,4.0,4,23,,https://jysk.vn/media/catalog/product/cache/2d1b3214b9b1ef59564a4bebf2c14d80/3/6/3630039-ban-lam-viec-vandborg-be-jysk.jpg
JYSK_0041,bàn làm việc vandborg gỗ công nghiệp kim loại màu sồi đen rộng 60 dài 120 cao 75cm,home decor,1192000,phân khúc trung cấp,4.2,8,3,,https://jysk.vn/media/catalog/product/cache/2d1b3214b9b1ef59564a4bebf2c14d80/3/6/3621018-ban-lam-viec-vandborg-mau-soi-den-jysk-1.jpg
JYSK_0042,bàn làm việc trappedal kim loại gỗ công nghiệp đen màu sồi rộng 48 dài 95 cao 76cm,home decor,1592000,phân khúc trung cấp,4.7,17,181,,https://jysk.vn/media/catalog/product/cache/2d1b3214b9b1ef59564a4bebf2c14d80/3/6/3601094-ban-lam-viec-trappedal-den-mau-soi-jysk-1.jpg
JYSK_0043,bàn làm việc trappedal kim loại gỗ công nghiệp trắng màu sồi rộng 48 dài 95 cao 76cm,home decor,1592000,phân khúc trung cấp,4.8,21,454,,https://jysk.vn/media/catalog/product/cache/2d1b3214b9b1ef59564a4bebf2c14d80/3/6/3601264-ban-lam-viec-trappedal-trang-mau-soi-jysk-1.jpg
JYSK_0044,bàn làm việc abbetved gỗ công nghiệp kim loại màu sồi trắng rộng 48 dài 120 cao 76cm,home decor,1743000,phân khúc trung cấp,4.3,3,50,,https://jysk.vn/media/catalog/product/cache/2d1b3214b9b1ef59564a4bebf2c14d80/3/6/3600446-ban-lam-viec-abbetved-mau-soi-trang-jysk.jpg
JYSK_0045,bàn làm việc abbetved kim loại gỗ công nghiệp đen màu sồi rộng 48 dài 120 cao 76cm,home decor,1992000,phân khúc trung cấp,4.8,77,319,,https://jysk.vn/media/catalog/product/cache/2d1b3214b9b1ef59564a4bebf2c14d80/3/6/3600497-ban-lam-viec-abbetved-den-mau-soi-jysk-1.jpg
JYSK_0046,bàn làm việc astrup gỗ công nghiệp kim loại đen rộng 60 dài 120 cao 75cm,home decor,2392000,phân khúc cận cao cấp,4.3,4,25,,https://jysk.vn/media/catalog/product/cache/2d1b3214b9b1ef59564a4bebf2c14d80/3/6/3650044-ban-lam-viec-astrup-den-jysk-1.jpg
JYSK_0047,bàn làm việc lindved gỗ công nghiệp kim loại màu sồi rộng 48 dài 120 cao 76cm,home decor,2392000,phân khúc cận cao cấp,4.6,36,179,,https://jysk.vn/media/catalog/product/cache/2d1b3214b9b1ef59564a4bebf2c14d80/3/6/3650015-ban-lam-viec-lindved-mau-soi-jysk-1.jpg
JYSK_0048,bàn làm việc stenvad gỗ công nghiệp kim loại trắng rộng 48 dài 120 cao 76cm,home decor,2392000,phân khúc cận cao cấp,4.8,13,304,,https://jysk.vn/media/catalog/product/cache/2d1b3214b9b1ef59564a4bebf2c14d80/3/6/3650207-ban-lam-viec-stenvad-trang-jysk-1.jpg
JYSK_0049,bàn làm việc tamholt gỗ công nghiệp gỗ cao su trắng sồi rộng 50 dài 100 cao 77cm,home decor,3120000,phân khúc cận cao cấp,4.7,97,273,,https://jysk.vn/media/catalog/product/cache/2d1b3214b9b1ef59564a4bebf2c14d80/3/6/3600632-ban-lam-viec-tamholt-trang-soi-jysk-1.jpg
JYSK_0050,bàn làm việc billund gỗ công nghiệp màu sồi trắng rộng 54 dài 120 cao 75cm,home decor,3192000,phân khúc cận cao cấp,4.1,5,18,,https://jysk.vn/media/catalog/product/cache/2d1b3214b9b1ef59564a4bebf2c14d80/3/6/3681622-ban-lam-viec-billund-mau-soi-trang-jysk-1.jpg
JYSK_0051,bàn làm việc billund gỗ công nghiệp trắng xám rộng 54 dài 120 cao 75cm,home decor,3192000,phân khúc cận cao cấp,4.8,42,154,,https://jysk.vn/media/catalog/product/cache/2d1b3214b9b1ef59564a4bebf2c14d80/3/6/3681949-ban-lam-viec-billund-trang-xam-jysk-1.jpg
JYSK_0052,bàn làm việc halsted thép gỗ công nghiệp đen rộng 60 dài 120 cao 74cm,home decor,3192000,phân khúc cận cao cấp,4.6,63,178,,https://jysk.vn/media/catalog/product/cache/2d1b3214b9b1ef59564a4bebf2c14d80/3/6/3600634-ban-lam-viec-halsted-den-jysk-1.jpg
JYSK_0053,bàn làm việc malling gỗ công nghiệp trắng rộng 50 dài 100 cao 75cm,home decor,3592000,phân khúc cận cao cấp,4.6,70,110,,https://jysk.vn/media/catalog/product/cache/2d1b3214b9b1ef59564a4bebf2c14d80/3/6/3630052-ban-lam-viec-malling-trang-jysk-2.jpg
JYSK_0054,bàn làm việc stege gỗ công nghiệp kim loại trắng bóng xám rộng 40 dài 120 cao 75cm,home decor,3600000,phân khúc cận cao cấp,4.7,65,400,,https://jysk.vn/media/catalog/product/cache/2d1b3214b9b1ef59564a4bebf2c14d80/3/6/3612382-ban-lam-viec-stege-trang-bong-xam-jysk-12.jpg
JYSK_0055,bàn làm việc vedde gỗ công nghiệp màu sồi đậm rộng 53 dài 121 cao 76cm,home decor,4400000,phân khúc cận cao cấp,4.8,97,294,,https://jysk.vn/media/catalog/product/cache/2d1b3214b9b1ef59564a4bebf2c14d80/3/6/3601078-ban-lam-viec-vedde-mau-soi-dam-jysk-4.jpg
JYSK_0056,bàn làm việc limfjorden gỗ công nghiệp màu sồi nhạt rộng 60 dài 120 cao 76cm,home decor,4720000,phân khúc cận cao cấp,4.5,73,470,,https://jysk.vn/media/catalog/product/cache/2d1b3214b9b1ef59564a4bebf2c14d80/3/6/3670185-ban-lam-viec-limfjorden-mau-soi-nhat-jysk-21.jpg
JYSK_0057,bàn làm việc limfjorden gỗ công nghiệp trắng rộng 60 dài 120 cao 76cm,home decor,4720000,phân khúc cận cao cấp,3.8,6,45,,https://jysk.vn/media/catalog/product/cache/2d1b3214b9b1ef59564a4bebf2c14d80/3/6/3670187-ban-lam-viec-limfjorden-trang-jysk-1.jpg
JYSK_0058,bàn làm việc điều chỉnh độ cao lundtoft gỗ công nghiệp thép be rộng 70 dài 130 cao 71 114cm,home decor,6230000,phân khúc cận cao cấp,4.6,58,208,,https://jysk.vn/media/catalog/product/cache/2d1b3214b9b1ef59564a4bebf2c14d80/3/6/3670569-ban-lam-viec-dieu-chinh-do-cao-lundtoft-be-jysk.jpg
JYSK_0059,bàn làm việc lintrup gỗ công nghiệp màu sồi rộng 60 dài 140 cao 75cm,home decor,6320000,phân khúc cận cao cấp,4.9,13,386,,https://jysk.vn/media/catalog/product/cache/2d1b3214b9b1ef59564a4bebf2c14d80/3/6/3630073-ban-lam-viec-lintrup-mau-soi-jysk.jpg
JYSK_0060,bàn làm việc markskel gỗ công nghiệp màu sồi trắng rộng 60 dài 120 cao 75cm,home decor,6320000,phân khúc cận cao cấp,4.5,27,360,,https://jysk.vn/media/catalog/product/cache/2d1b3214b9b1ef59564a4bebf2c14d80/3/6/3670188-ban-lam-viec-markskel-mau-soi-trang-jysk-13.jpg
JYSK_0061,bàn làm việc điều chỉnh độ cao svaneke gỗ công nghiệp thép đen rộng 80 dài 160 cao 70 119cm,home decor,9030000,phân khúc cận cao cấp,4.8,78,238,,https://jysk.vn/media/catalog/product/cache/2d1b3214b9b1ef59564a4bebf2c14d80/3/6/3601339-ban-lam-viec-dieu-chinh-do-cao-svaneke-den-jysk-1.jpg
JYSK_0062,bàn làm việc điều chỉnh độ cao svaneke gỗ công nghiệp thép trắng rộng 80 dài 160 cao 70 119cm,home decor,9030000,phân khúc cận cao cấp,5.0,98,476,,https://jysk.vn/media/catalog/product/cache/2d1b3214b9b1ef59564a4bebf2c14d80/3/6/3601340-ban-lam-viec-dieu-chinh-do-cao-svaneke-trang-jysk-1.jpg
JYSK_0063,bàn góc randerup kim loại đỏ thẫm đường kính 47 cao 51cm,home decor,399200,phân khúc phổ thông,4.7,12,182,,https://jysk.vn/media/catalog/product/cache/2d1b3214b9b1ef59564a4bebf2c14d80/3/6/3630104-ban-goc-randerup-mau-do-tham-jysk.jpg
JYSK_0064,kệ đa năng kareby nhựa pp be rộng 40 sâu 18 cao 56cm,home decor,399200,phân khúc phổ thông,4.3,4,28,,https://jysk.vn/media/catalog/product/cache/2d1b3214b9b1ef59564a4bebf2c14d80/2/7/2777412-ke-da-nang-kareby-be-jysk.jpg
JYSK_0065,bàn góc taps gỗ công nghiệp tre ép trắng sồi rộng 55 dài 55 cao 45cm,home decor,639200,phân khúc trung cấp,4.2,6,20,,https://jysk.vn/media/catalog/product/cache/2d1b3214b9b1ef59564a4bebf2c14d80/3/6/3690293-ban-goc-taps-trang-soi-jysk-1.jpg
JYSK_0066,bảng treo tường kèm phụ kiện funder kim loại nhựa be rộng 52 sâu 11 cao 42 51cm,home decor,799200,phân khúc trung cấp,5.0,67,237,,https://jysk.vn/media/catalog/product/cache/2d1b3214b9b1ef59564a4bebf2c14d80/3/6/3630116-bang-treo-tuong-kem-phu-kien-funder-be-jysk.jpg
JYSK_0067,kệ đa năng kanstrup kim loại pp màu cát rộng 47 sâu 31 cao 79cm,home decor,799200,phân khúc trung cấp,4.8,53,299,,https://jysk.vn/media/catalog/product/cache/2d1b3214b9b1ef59564a4bebf2c14d80/3/6/3601114-ke-da-nang-kanstrup-mau-cat-jysk-1.jpg
JYSK_0068,kệ đa năng kanstrup nhựa pp thép đen rộng 47 sâu 31 cao 79cm,home decor,799200,phân khúc trung cấp,4.1,9,20,,https://jysk.vn/media/catalog/product/cache/2d1b3214b9b1ef59564a4bebf2c14d80/3/6/3670183-ke-day-co-banh-xe-kanstrup-den-jysk-1.jpg
JYSK_0069,bàn cafe nybo gỗ công nghiệp kim loại đen sồi đường kính 70 cao 43cm,home decor,952000,phân khúc trung cấp,3.9,2,33,,https://jysk.vn/media/catalog/product/cache/2d1b3214b9b1ef59564a4bebf2c14d80/3/6/3650016-ban-cafe-nybo-den-soi-jysk-1.jpg
JYSK_0070,kệ đẩy có bánh xe egtved tre màu tự nhiên rộng 45 sâu 33 cao 75cm,home decor,952000,phân khúc trung cấp,4.7,58,102,,https://jysk.vn/media/catalog/product/cache/2d1b3214b9b1ef59564a4bebf2c14d80/3/6/3650228-ke-day-co-banh-xe-egtved-mau-tu-nhien-jysk-1.jpg
JYSK_0071,kệ đẩy có bánh xe gangsted thép gỗ công nghiệp màu sồi đen rộng 56 sâu 40 cao 69cm,home decor,952000,phân khúc trung cấp,4.1,9,49,,https://jysk.vn/media/catalog/product/cache/2d1b3214b9b1ef59564a4bebf2c14d80/3/6/3690314-ke-day-co-banh-xe-gangsted-mau-soi-den-jysk-1.jpg
JYSK_0072,bàn góc bolbro gỗ công nghiệp xanh nhạt đường kính 45 cao 42cm,home decor,1032000,phân khúc trung cấp,4.2,5,30,,https://jysk.vn/media/catalog/product/cache/2d1b3214b9b1ef59564a4bebf2c14d80/3/6/3670221-ban-goc-bolbro-xanh-nhat-jysk-1.jpg
JYSK_0073,bàn góc nielshave gỗ công nghiệp vân đá cẩm thạch đường kính 55 cao 42cm,home decor,1192000,phân khúc trung cấp,4.3,6,22,,https://jysk.vn/media/catalog/product/cache/2d1b3214b9b1ef59564a4bebf2c14d80/3/6/3650188-ban-goc-nielshave-van-da-cam-thach-jysk.jpg
JYSK_0074,bàn góc stige gỗ công nghiệp tre màu tự nhiên rộng 46 dài 50 cao 45cm,home decor,1192000,phân khúc trung cấp,4.6,27,349,,https://jysk.vn/media/catalog/product/cache/2d1b3214b9b1ef59564a4bebf2c14d80/3/6/3670169-ban-goc-stige-mau-tu-nhien-jysk-1.jpg
JYSK_0075,kệ đa năng narup nhựa pp thép đen rộng 55 sâu 40 cao 72cm,home decor,1352000,phân khúc trung cấp,4.0,7,22,,https://jysk.vn/media/catalog/product/cache/2d1b3214b9b1ef59564a4bebf2c14d80/3/6/3630053-ke-da-nang-narup-den-jysk.jpg
JYSK_0076,bàn cafe lejre gỗ công nghiệp gỗ sồi trắng sồi rộng 48 dài 85 cao 40cm,home decor,1592000,phân khúc trung cấp,4.8,27,166,,https://jysk.vn/media/catalog/product/cache/2d1b3214b9b1ef59564a4bebf2c14d80/3/6/3690305-ban-cafe-lejre-trang-soi-jysk-1.jpg
JYSK_0077,bàn góc lundeborg gỗ công nghiệp màu đá cẩm thạch rộng 50 sâu 38 cao 47cm,home decor,1592000,phân khúc trung cấp,4.9,20,195,,https://jysk.vn/media/catalog/product/cache/2d1b3214b9b1ef59564a4bebf2c14d80/3/6/3680088-ban-goc-lunderborg-mau-da-cam-thach-jysk-10.jpg
JYSK_0078,bộ 2 bàn góc falsled kính cường lực gỗ sồi trong suốt sồi đường kính 50 40 cao 45 40cm,home decor,1592000,phân khúc trung cấp,4.5,20,369,,https://jysk.vn/media/catalog/product/cache/2d1b3214b9b1ef59564a4bebf2c14d80/3/6/3690238-bo-2-ban-goc-falsled-trong-suot-soi-jysk-1.jpg
JYSK_0079,kệ đa năng sollerup gỗ thông màu tự nhiên rộng 33 dài 40 cao 50cm,home decor,1592000,phân khúc trung cấp,4.6,36,142,,https://jysk.vn/media/catalog/product/cache/2d1b3214b9b1ef59564a4bebf2c14d80/3/6/3670119-ke-da-nang-sollerup-mau-tu-nhien-jysk-1.jpg
JYSK_0080,tủ treo tường có kính malling kính gỗ công nghiệp trắng rộng 40 sâu 19 cao 60cm,home decor,1592000,phân khúc trung cấp,4.6,51,84,,https://jysk.vn/media/catalog/product/cache/2d1b3214b9b1ef59564a4bebf2c14d80/3/6/3690160-tu-treo-tuong-co-kinh-malling-trang-jysk.jpg
JYSK_0081,bàn cafe nielshave gỗ công nghiệp vân đá cẩm thạch đường kính 70 cao 45cm,home decor,1992000,phân khúc trung cấp,3.9,6,13,,https://jysk.vn/media/catalog/product/cache/2d1b3214b9b1ef59564a4bebf2c14d80/3/6/3650187-ban-cafe-nielshave-van-da-cam-thach-jysk.jpg
JYSK_0082,tủ đồ give gỗ công nghiệp kim loại xanh rộng 37 sâu 35 cao 70cm,home decor,1992000,phân khúc trung cấp,4.4,4,13,,https://jysk.vn/media/catalog/product/cache/2d1b3214b9b1ef59564a4bebf2c14d80/3/6/3670172-tu-do-give-xanh-jysk-7.jpg
JYSK_0083,bàn góc gandrup gỗ công nghiệp màu đá cẩm thạch trắng rộng 45 dài 45 cao 42cm,home decor,2152000,phân khúc cận cao cấp,4.2,6,10,,https://jysk.vn/media/catalog/product/cache/2d1b3214b9b1ef59564a4bebf2c14d80/3/6/3670168-ban-goc-gandrup-mau-da-cam-thach-trang-jysk-1.jpg
JYSK_0084,bàn cafe dokkedal kim loại gỗ công nghiệp xám đen rộng 75 dài 115 cao 45cm,home decor,2320000,phân khúc cận cao cấp,4.9,54,306,,https://jysk.vn/media/catalog/product/cache/2d1b3214b9b1ef59564a4bebf2c14d80/3/6/3601245-ban-cafe-dokkedal-_jysk-1.jpg
JYSK_0085,bàn cafe vedde gỗ công nghiệp màu sồi đậm rộng 60 dài 110 cao 45cm,home decor,2320000,phân khúc cận cao cấp,4.1,1,48,,https://jysk.vn/media/catalog/product/cache/2d1b3214b9b1ef59564a4bebf2c14d80/3/6/3690444-ban-cafe-vedde-mau-soi-dam-jysk-1.jpg
JYSK_0086,kệ đa năng spodsbjerg gỗ công nghiệp thép màu sồi đường kính 35 cao 60cm,home decor,2392000,phân khúc cận cao cấp,4.0,6,42,,https://jysk.vn/media/catalog/product/cache/2d1b3214b9b1ef59564a4bebf2c14d80/3/6/3670155-ke-da-nang-spodsbjerg-mau-soi-jysk-6.jpg
JYSK_0087,tủ treo tường malling kính gỗ công nghiệp trắng rộng 35 sâu 12 cao 60cm,home decor,2392000,phân khúc cận cao cấp,4.7,26,305,,https://jysk.vn/media/catalog/product/cache/2d1b3214b9b1ef59564a4bebf2c14d80/3/6/3670064-tu-treo-tuong-malling-trang-jysk.jpg
JYSK_0088,bàn cafe lintrup gỗ công nghiệp màu sồi rộng 60 dài 110 cao 45cm,home decor,2792000,phân khúc cận cao cấp,4.7,90,206,,https://jysk.vn/media/catalog/product/cache/2d1b3214b9b1ef59564a4bebf2c14d80/3/6/3670184-ban-cafe-lintrup-mau-soi-jysk-1.jpg
JYSK_0089,bàn cafe tebstrup thép gỗ công nghiệp đen màu sồi rộng 60 dài 60 cao 45cm,home decor,2792000,phân khúc cận cao cấp,4.4,5,20,,https://jysk.vn/media/catalog/product/cache/2d1b3214b9b1ef59564a4bebf2c14d80/3/6/3619011-ban-cafe-tebstrup-den-mau-soi-jysk-10.jpg
JYSK_0090,kệ đa năng lumby xi măng vân đá cẩm thạch đường kính 30 cao 59cm,home decor,2792000,phân khúc cận cao cấp,4.9,55,121,,https://jysk.vn/media/catalog/product/cache/2d1b3214b9b1ef59564a4bebf2c14d80/3/6/3630079-ke-da-nang-lumby-van-da-cam-thach-jysk.jpg
JYSK_0091,bàn cafe gadevang kính cường lực kim loại trắng vàng đường kính 65 cao 45cm,home decor,3192000,phân khúc cận cao cấp,4.9,10,313,,https://jysk.vn/media/catalog/product/cache/2d1b3214b9b1ef59564a4bebf2c14d80/3/6/3600835-ban-cafe-gadevang-trang-vang-jysk-11.jpg
JYSK_0092,bàn cafe lisbjerg gỗ công nghiệp màu sồi rộng 60 dài 107 cao 45cm,home decor,3192000,phân khúc cận cao cấp,4.8,42,237,,https://jysk.vn/media/catalog/product/cache/2d1b3214b9b1ef59564a4bebf2c14d80/3/6/3670052-ban-cafe-lisbjerg-mau-soi-jysk-1.jpg
JYSK_0093,bàn cafe lundeborg gỗ công nghiệp màu đá cẩm thạch rộng 68 dài 85 cao 42cm,home decor,3192000,phân khúc cận cao cấp,4.1,3,23,,https://jysk.vn/media/catalog/product/cache/2d1b3214b9b1ef59564a4bebf2c14d80/3/6/3650100-ban-cafe-lundeborg-mau-da-cam-thach-jysk-1.jpg
JYSK_0094,bàn cafe ravnsbjerg gỗ công nghiệp màu tự nhiên rộng 90 sâu 90 cao 35cm,home decor,3192000,phân khúc cận cao cấp,4.6,62,353,,https://jysk.vn/media/catalog/product/cache/2d1b3214b9b1ef59564a4bebf2c14d80/3/6/3630049-ban-cafe-ravnsbjerg-mau-tu-nhien-jysk-21.jpg
JYSK_0095,bộ 2 bàn góc brabrand thép gỗ công nghiệp đen sồi đường kính 70 50 cao 45 42cm,home decor,3192000,phân khúc cận cao cấp,4.0,9,14,,https://jysk.vn/media/catalog/product/cache/2d1b3214b9b1ef59564a4bebf2c14d80/3/6/3690198-bo-2-ban-goc-brabrand-den-soi-jysk-1.jpg
JYSK_0096,bàn cafe markskel gỗ công nghiệp màu sồi xám rộng 60 dài 110 cao 53cm,home decor,3592000,phân khúc cận cao cấp,3.9,0,9,,https://jysk.vn/media/catalog/product/cache/2d1b3214b9b1ef59564a4bebf2c14d80/3/6/3681142-ban-cafe-markskel-mau-soi-xam-jysk-1.jpg
JYSK_0097,kệ đa năng lydum gốm màu chrome đường kính 30 cao 44cm,home decor,3592000,phân khúc cận cao cấp,4.4,6,23,,https://jysk.vn/media/catalog/product/cache/2d1b3214b9b1ef59564a4bebf2c14d80/3/6/3630054-ke-da-nang-lydum-mau-chrome-jysk-3.jpg
JYSK_0098,bàn cafe hinnerup kim loại gỗ công nghiệp màu sồi đen rộng 75 dài 120 cao 45cm,home decor,3920000,phân khúc cận cao cấp,4.3,0,11,,https://jysk.vn/media/catalog/product/cache/2d1b3214b9b1ef59564a4bebf2c14d80/3/6/3600502-ban-cafe-hinnerup-mau-soi-den-jysk-1.jpg
JYSK_0099,bàn cafe rolsted gỗ công nghiệp màu đá cẩm thạch rộng 58 50 dài 58 50 cao 40 33cm,home decor,3920000,phân khúc cận cao cấp,3.9,7,4,,https://jysk.vn/media/catalog/product/cache/2d1b3214b9b1ef59564a4bebf2c14d80/3/6/3650087-ban-cafe-rolsted-mau-da-cam-thach-jysk-1.jpg
JYSK_0100,bàn cafe lydum xi măng be xám đường kính 60 cao 40cm,home decor,4720000,phân khúc cận cao cấp,4.7,48,259,,https://jysk.vn/media/catalog/product/cache/2d1b3214b9b1ef59564a4bebf2c14d80/3/6/3630037-ban-cafe-lydum-be-xam-jysk_1.jpg
