product_id,title,category,current_price,price_segment,rating_score,review_count,total_sold,gender,image_url
JYSK_0927,bộ 3 khăn đa năng cotton gerbera xám than rộng 50 dài 70cm,home decor,159200,phân khúc phổ thông,4.2,4,12,,https://jysk.vn/media/catalog/product/cache/2d1b3214b9b1ef59564a4bebf2c14d80/2/4/2408542-bo-3-khan-da-nang-gerbera-xam-than-jysk.jpg
JYSK_0928,khăn đa năng fristad xám rộng 30 dài 30cm bộ 4 chiếc,home decor,159200,phân khúc phổ thông,4.4,9,25,,https://jysk.vn/media/catalog/product/cache/2d1b3214b9b1ef59564a4bebf2c14d80/2/0/2002300-khan-da-nang-fristad-r30xd30cm-jysk.jpg
JYSK_0929,tấm lót đĩa flotgras silicone màu vàng cát đậm rộng 34 dài 37cm,home decor,159200,phân khúc phổ thông,4.5,11,289,,https://jysk.vn/media/catalog/product/cache/2d1b3214b9b1ef59564a4bebf2c14d80/1/7/1766207-tam-lot-dia-flotgras-mau-vang-cat-dam-jysk.jpg
JYSK_0930,tấm lót đĩa hvidpil sợi đay màu tự nhiên đường kính 38cm,home decor,159200,phân khúc phổ thông,4.9,77,489,,https://jysk.vn/media/catalog/product/cache/2d1b3214b9b1ef59564a4bebf2c14d80/1/7/1763200-tam-lot-dia-hvidpil-mau-tu-nhien-jysk-21.jpg
JYSK_0931,tấm lót đĩa tettegras sợi ngô xanh lá nhạt đường kính 38cm,home decor,159200,phân khúc phổ thông,4.0,4,33,,https://jysk.vn/media/catalog/product/cache/2d1b3214b9b1ef59564a4bebf2c14d80/1/7/1720728-tam-lot-dia-tettegras-xanh-la-nhat-jysk-1.jpg
JYSK_0932,bộ 2 khăn đa năng cotton myrmaure nhiều màu rộng 50 dài 70cm,home decor,199200,phân khúc phổ thông,3.8,8,23,,https://jysk.vn/media/catalog/product/cache/2d1b3214b9b1ef59564a4bebf2c14d80/2/4/2408100-bo-2-khan-da-nangmyrmaure-jysk-1.jpg
JYSK_0933,bộ 2 khăn đa năng cotton sav be xám rộng 50 dài 70cm,home decor,199200,phân khúc phổ thông,4.6,52,363,,https://jysk.vn/media/catalog/product/cache/2d1b3214b9b1ef59564a4bebf2c14d80/2/4/2407600-bo-2-khan-da-nang-sav-be-xam-jysk-1.jpg
JYSK_0934,bộ 3 khăn đa năng cotton neem nhiều màu rộng 50 dài 70cm,home decor,199200,phân khúc phổ thông,4.3,0,10,,https://jysk.vn/media/catalog/product/cache/2d1b3214b9b1ef59564a4bebf2c14d80/2/4/2408900-bo-3-khan-da-nang-neem-jysk.jpg
JYSK_0935,khăn table runner kastanie cotton màu tự nhiên rộng 38 dài 150cm,home decor,199200,phân khúc phổ thông,4.8,15,263,,https://jysk.vn/media/catalog/product/cache/2d1b3214b9b1ef59564a4bebf2c14d80/1/7/1760644-khan-table-runner-kastanie-mau-tu-nhien-jysk.jpg
JYSK_0936,khăn table runner sennergras cotton polyester nâu xám rộng 40 dài 150cm,home decor,199200,phân khúc phổ thông,4.3,3,17,,https://jysk.vn/media/catalog/product/cache/2d1b3214b9b1ef59564a4bebf2c14d80/1/7/1729201-khan-table-runner-sennergras-nau-xam-jysk.jpg
JYSK_0937,khăn table runner sennergras cotton polyester xám rộng 40 dài 150cm,home decor,199200,phân khúc phổ thông,4.3,4,42,,https://jysk.vn/media/catalog/product/cache/2d1b3214b9b1ef59564a4bebf2c14d80/1/7/1729200-khan-table-runner-sennergras-xam-jysk.jpg
JYSK_0938,khăn table runner ullvier sợi đay cotton màu tự nhiên be rộng 38 dài 150cm,home decor,199200,phân khúc phổ thông,3.9,8,13,,https://jysk.vn/media/catalog/product/cache/2d1b3214b9b1ef59564a4bebf2c14d80/1/7/1762244-khan-table-runner-ullvier-mau-tu-nhien-be-jysk-1.jpg
JYSK_0939,bộ 2 khăn đa năng cotton krekling xanh rộng 50 dài 70cm,home decor,239200,phân khúc phổ thông,4.3,6,19,,https://jysk.vn/media/catalog/product/cache/2d1b3214b9b1ef59564a4bebf2c14d80/2/4/2409700-bo-2-khan-da-nangkrekling-xanh-jysk.jpg
JYSK_0940,khăn table runner andermat cotton be rộng 40 dài 150cm,home decor,239200,phân khúc phổ thông,4.9,21,236,,https://jysk.vn/media/catalog/product/cache/2d1b3214b9b1ef59564a4bebf2c14d80/1/7/1736100-khan-table-runner-andermat-be-jysk.jpg
JYSK_0941,khăn table runner bekkeblom cotton xanh rêu rộng 40 dài 150cm,home decor,239200,phân khúc phổ thông,3.9,8,42,,https://jysk.vn/media/catalog/product/cache/2d1b3214b9b1ef59564a4bebf2c14d80/1/7/1763129-khan-table-runner-bekkeblom-xanh-reu-jysk.jpg
JYSK_0942,khăn table runner brunelle polyester be rộng 40 dài 150cm,home decor,239200,phân khúc phổ thông,3.9,3,49,,https://jysk.vn/media/catalog/product/cache/2d1b3214b9b1ef59564a4bebf2c14d80/1/7/1762144-khan-table-runner-brunelle-be-jysk.jpg
JYSK_0943,khăn table runner lundalm sợi giấy polyester màu tự nhiên rộng 37 dài 150cm,home decor,239200,phân khúc phổ thông,4.1,8,28,,https://jysk.vn/media/catalog/product/cache/2d1b3214b9b1ef59564a4bebf2c14d80/1/7/1759300-khan-table-runner-lundalm-mau-tu-nhien-jysk.jpg
JYSK_0944,khăn table runner vandiris cotton trắng rộng 37 dài 150cm,home decor,239200,phân khúc phổ thông,4.1,2,26,,https://jysk.vn/media/catalog/product/cache/2d1b3214b9b1ef59564a4bebf2c14d80/1/7/1763800-khan-table-runner-vandiris-trang-jysk-7.jpg
JYSK_0945,khăn phủ bàn blomme polyester xám đường kính 120cm,home decor,279200,phân khúc phổ thông,4.6,98,218,,https://jysk.vn/media/catalog/product/cache/2d1b3214b9b1ef59564a4bebf2c14d80/6/0/6093842-tam-trai-ban-blomme-xam-jysk-11.jpg
JYSK_0946,khăn phủ bàn soleihov polyester cotton xanh rộng 140cm,home decor,279200,phân khúc phổ thông,3.8,3,12,,https://jysk.vn/media/catalog/product/cache/2d1b3214b9b1ef59564a4bebf2c14d80/5/7/5703000-khan-phu-ban-soleihov-xanh-jysk.jpg
JYSK_0947,khăn phủ bàn engfiol cotton be xám đường kính 160cm,home decor,319200,phân khúc phổ thông,3.8,4,25,,https://jysk.vn/media/catalog/product/cache/2d1b3214b9b1ef59564a4bebf2c14d80/1/7/1764944-khan-phu-ban-engfiol-be-xam-jysk.jpg
JYSK_0948,khăn phủ bàn stilkeg polyester be đường kính 160cm,home decor,319200,phân khúc phổ thông,4.5,96,291,,https://jysk.vn/media/catalog/product/cache/2d1b3214b9b1ef59564a4bebf2c14d80/1/7/1762844-khan-phu-ban-stilkeg-jysk-11.jpg
JYSK_0949,khăn phủ bàn fjellrapp polyester xanh lá rộng 140 dài 240cm,home decor,399200,phân khúc phổ thông,4.3,5,46,,https://jysk.vn/media/catalog/product/cache/2d1b3214b9b1ef59564a4bebf2c14d80/1/7/1763766-khan-phu-ban-fjellrapp-xanh-la-jysk-6.jpeg
JYSK_0950,khăn phủ bàn stilkeg polyester be rộng 140 dài 240cm,home decor,399200,phân khúc phổ thông,3.8,7,39,,https://jysk.vn/media/catalog/product/cache/2d1b3214b9b1ef59564a4bebf2c14d80/1/7/1758909-khan-phu-ban-stilkeg-be-jysk.jpg
JYSK_0951,khăn phủ bàn stilkeg polyester xanh rộng 140 dài 240cm,home decor,399200,phân khúc phổ thông,4.5,25,491,,https://jysk.vn/media/catalog/product/cache/2d1b3214b9b1ef59564a4bebf2c14d80/1/7/1762736-khan-phu-ban-stilkeg-xanh-jysk.jpg
JYSK_0952,khăn phủ bàn blomme polyester xám rộng 140 dài 240cm,home decor,479200,phân khúc phổ thông,4.1,1,8,,https://jysk.vn/media/catalog/product/cache/2d1b3214b9b1ef59564a4bebf2c14d80/6/0/6093643-khan-phu-ban-blomme-xam-jysk-3.jpg
JYSK_0953,khăn phủ bàn brearve cotton màu tự nhiên xám rộng 140 dài 240cm,home decor,479200,phân khúc phổ thông,4.3,8,46,,https://jysk.vn/media/catalog/product/cache/2d1b3214b9b1ef59564a4bebf2c14d80/1/7/1763500-khan-phu-ban-brearve-mau-tu-nhien-xam-jysk-11_3.jpg
JYSK_0954,khăn phủ bàn engfiol cotton be xám rộng 140 dài 240cm,home decor,479200,phân khúc phổ thông,3.9,2,18,,https://jysk.vn/media/catalog/product/cache/2d1b3214b9b1ef59564a4bebf2c14d80/1/7/1760844-khan-phu-ban-engfiol-be-xam-jysk.jpg
JYSK_0955,khăn phủ bàn greplyng cotton be rộng 140 dài 240cm,home decor,479200,phân khúc phổ thông,4.5,56,384,,https://jysk.vn/media/catalog/product/cache/2d1b3214b9b1ef59564a4bebf2c14d80/1/7/1762644-khan-phu-ban-greplyng-be-jysk-1.jpg
JYSK_0956,khăn phủ bàn lappvier cotton polyester xám rộng 140 dài 240cm,home decor,479200,phân khúc phổ thông,4.6,19,498,,https://jysk.vn/media/catalog/product/cache/2d1b3214b9b1ef59564a4bebf2c14d80/1/7/1762542-khan-phu-ban-lappvier-xam-jysk-1.jpg
JYSK_0957,khăn phủ bàn agermynte cotton polyester trắng rộng 140 dài 240cm,home decor,519200,phân khúc trung cấp,4.2,6,21,,https://jysk.vn/media/catalog/product/cache/2d1b3214b9b1ef59564a4bebf2c14d80/1/7/1712802-khan-phu-ban-agermynte-trang-jysk-1.jpg
JYSK_0958,khăn phủ bàn agermynte cotton polyester xám rộng 140 dài 240cm,home decor,519200,phân khúc trung cấp,4.9,10,87,,https://jysk.vn/media/catalog/product/cache/2d1b3214b9b1ef59564a4bebf2c14d80/1/7/1712804-khan-phu-ban-agermynte-xam-jysk_1.jpg
JYSK_0959,khăn phủ bàn blindurt cotton polyester xanh olive rộng 140 dài 240cm,home decor,559200,phân khúc trung cấp,4.9,83,384,,https://jysk.vn/media/catalog/product/cache/2d1b3214b9b1ef59564a4bebf2c14d80/1/7/1763427-khan-phu-ban-blindurt-xanh-olive-jysk-7.jpg
JYSK_0960,khăn phủ bàn dagfiol cotton polyester xám rộng 140 dài 240cm,home decor,559200,phân khúc trung cấp,4.5,57,131,,https://jysk.vn/media/catalog/product/cache/2d1b3214b9b1ef59564a4bebf2c14d80/1/7/1765242-khan-phu-ban-dagfiol-xam-jysk-1.jpg
JYSK_0961,khăn phủ bàn pelargonia cotton be rộng 140 dài 240cm,home decor,559200,phân khúc trung cấp,4.0,6,7,,https://jysk.vn/media/catalog/product/cache/2d1b3214b9b1ef59564a4bebf2c14d80/1/7/1765544-khan-phu-ban-pelargonia-be-jysk.jpg
JYSK_0962,khăn phủ bàn kastanie cotton linen màu tự nhiên rộng 140 dài 240cm,home decor,792000,phân khúc trung cấp,4.9,74,207,,https://jysk.vn/media/catalog/product/cache/2d1b3214b9b1ef59564a4bebf2c14d80/1/7/1761144-khan-phu-ban-kastanie-mau-tu-nhien-jysk.jpg
JYSK_0963,tủ đầu giường ilbro gỗ tự nhiên màu sồi nhạt rộng 45 sâu 32 cao 54cm,home decor,952000,phân khúc trung cấp,4.7,78,357,,https://jysk.vn/media/catalog/product/cache/2d1b3214b9b1ef59564a4bebf2c14d80/3/6/3616931-tu-dau-giuong-ilbro-mau-soi-nhat-jysk.jpg
JYSK_0964,tủ đầu giường broby gỗ công nghiệp tre ép trắng tự nhiên rộng 45 sâu 38 cao 50cm,home decor,1192000,phân khúc trung cấp,4.2,8,47,,https://jysk.vn/media/catalog/product/cache/2d1b3214b9b1ef59564a4bebf2c14d80/3/6/3601242-tu-dau-giuong-broby-trang-tu-nhien-jysk.jpg
JYSK_0965,tủ đầu giường jenslev gỗ công nghiệp màu sồi rộng 41 sâu 33 cao 57cm,home decor,1192000,phân khúc trung cấp,3.9,3,6,,https://jysk.vn/media/catalog/product/cache/2d1b3214b9b1ef59564a4bebf2c14d80/3/6/3600380-tu-dau-giuong-jenslev-mau-soi-jysk.jpg
JYSK_0966,tủ đầu giường jenslev gỗ công nghiệp trắng rộng 41 sâu 33 cao 57cm,home decor,1192000,phân khúc trung cấp,4.5,76,106,,https://jysk.vn/media/catalog/product/cache/2d1b3214b9b1ef59564a4bebf2c14d80/3/6/3601399-tu-dau-giuong-jenslev-trang-jysk.jpg
JYSK_0967,tủ ngăn kéo 3 ngăn odby gỗ công nghiệp trắng xám rộng 37 sâu 30 cao 80cm,home decor,1192000,phân khúc trung cấp,4.0,10,46,,https://jysk.vn/media/catalog/product/cache/2d1b3214b9b1ef59564a4bebf2c14d80/3/6/3601243-tu-ngan-keo-3-ngan-odby-trang--xam-jysk-1.jpg
JYSK_0968,tủ đầu giường nordby gỗ công nghiệp trắng rộng 42 sâu 32 cao 65cm,home decor,1352000,phân khúc trung cấp,3.9,7,50,,https://jysk.vn/media/catalog/product/cache/2d1b3214b9b1ef59564a4bebf2c14d80/3/6/3601291-tu-dau-giuong-nordby-trang-jysk.jpg
JYSK_0969,tủ đầu giường skave gỗ công nghiệp be rộng 40 sâu 35 cao 56cm,home decor,1352000,phân khúc trung cấp,4.5,61,228,,https://jysk.vn/media/catalog/product/cache/2d1b3214b9b1ef59564a4bebf2c14d80/3/6/3670558-tu-dau-giuong-skave-be-jysk.jpg
JYSK_0970,tủ đầu giường hemdrup gỗ công nghiệp thép đen sồi rộng 40 sâu 38 cao 55cm,home decor,1592000,phân khúc trung cấp,5.0,28,83,,https://jysk.vn/media/catalog/product/cache/2d1b3214b9b1ef59564a4bebf2c14d80/3/6/3670017-tu-dau-giuong-hemdrup-den-soi-jysk.jpg
JYSK_0971,tủ đầu giường hokksund gỗ công nghiệp nâu rộng 45 sâu 33 cao 55cm,home decor,1992000,phân khúc trung cấp,4.0,4,27,,https://jysk.vn/media/catalog/product/cache/2d1b3214b9b1ef59564a4bebf2c14d80/3/6/3663800-tu-dau-giuong-hokksund-nau-jysk-3.jpg
JYSK_0972,tủ đầu giường limfjorden gỗ công nghiệp màu sồi nhạt rộng 41 sâu 48 cao 56cm,home decor,1992000,phân khúc trung cấp,4.9,57,127,,https://jysk.vn/media/catalog/product/cache/2d1b3214b9b1ef59564a4bebf2c14d80/3/6/3618927-tu-dau-giuong-limfjorden-mau-soi-nhat-jysk.jpg
JYSK_0973,tủ đầu giường limfjorden gỗ công nghiệp màu sồi rộng 41 sâu 48 cao 56cm,home decor,1992000,phân khúc trung cấp,4.8,21,86,,https://jysk.vn/media/catalog/product/cache/2d1b3214b9b1ef59564a4bebf2c14d80/3/6/3670444-tu-dau-giuong-limfjorden-mau-soi-jysk.jpg
JYSK_0974,tủ đầu giường limfjorden gỗ công nghiệp trắng rộng 41 sâu 48 cao 56cm,home decor,1992000,phân khúc trung cấp,4.1,0,34,,https://jysk.vn/media/catalog/product/cache/2d1b3214b9b1ef59564a4bebf2c14d80/3/6/3618924-tu-dau-giuong-limfjorden-trang-jysk.jpg
JYSK_0975,tủ đầu giường vedde gỗ công nghiệp màu sồi đậm rộng 50 sâu 43 cao 45cm,home decor,1992000,phân khúc trung cấp,4.8,89,141,,https://jysk.vn/media/catalog/product/cache/2d1b3214b9b1ef59564a4bebf2c14d80/3/6/3601069-tu-dau-giuong-vedde-mau-soi-dam-jysk.jpg
JYSK_0976,tủ đầu giường halmstad gỗ công nghiệp gỗ tự nhiên màu sồi rộng 40 sâu 40 cao 57cm,home decor,2245000,phân khúc cận cao cấp,4.4,6,20,,https://jysk.vn/media/catalog/product/cache/2d1b3214b9b1ef59564a4bebf2c14d80/3/6/3655003-tu-dau-giuong-halmstad-mau-soi-jysk.jpg
JYSK_0977,tủ đầu giường odense gỗ công nghiệp đen sồi rộng 42 sâu 35 cao 65cm,home decor,2392000,phân khúc cận cao cấp,4.4,8,49,,https://jysk.vn/media/catalog/product/cache/2d1b3214b9b1ef59564a4bebf2c14d80/3/6/3670424-tu-dau-giuong-odense-den-soi-jysk-7.jpg
JYSK_0978,tủ đầu giường manderup gỗ công nghiệp nhựa màu sồi rộng 49 sâu 43 cao 67cm,home decor,2792000,phân khúc cận cao cấp,4.9,25,467,,https://jysk.vn/media/catalog/product/cache/2d1b3214b9b1ef59564a4bebf2c14d80/3/6/3670262-tu-dau-giuong-manderup-mau-soi-jysk-11.jpg
JYSK_0979,tủ ngăn kéo billund gỗ công nghiệp trắng xám rộng 71 sâu 39 cao 90cm,home decor,4392000,phân khúc cận cao cấp,4.0,3,19,,https://jysk.vn/media/catalog/product/cache/2d1b3214b9b1ef59564a4bebf2c14d80/3/6/3600862-tu-ngan-keo-billund-trang-xam-jysk.jpg
JYSK_0980,tủ ngăn kéo 4 ngăn trappedal gỗ công nghiệp thép màu sồi rộng 70 sâu 40 cao 75cm,home decor,4720000,phân khúc cận cao cấp,4.9,49,207,,https://jysk.vn/media/catalog/product/cache/2d1b3214b9b1ef59564a4bebf2c14d80/3/6/3698210-tu-ngan-keo-4-ngan-trappedal-jysk.jpg
JYSK_0981,tủ ngăn kéo 4 ngăn limfjorden gỗ công nghiệp màu sồi rộng 81 sâu 48 cao 101cm,home decor,5192000,phân khúc cận cao cấp,4.3,1,31,,https://jysk.vn/media/catalog/product/cache/2d1b3214b9b1ef59564a4bebf2c14d80/3/6/3670192-tu-ngan-keo-4-ngan-limfjorden-mau-soi-jysk_1.jpg
JYSK_0982,tủ ngăn kéo 4 ngăn lintrup gỗ công nghiệp màu sồi rộng 91 sâu 41 cao 93cm,home decor,5520000,phân khúc cận cao cấp,4.9,29,189,,https://jysk.vn/media/catalog/product/cache/2d1b3214b9b1ef59564a4bebf2c14d80/3/6/3600361-tu-ngan-keo-4-ngan-lintrup-mau-soi-jysk-1.jpg
JYSK_0983,tủ ngăn kéo 5 ngăn vedde gỗ công nghiệp màu sồi đậm rộng 50 sâu 43 cao 126cm,home decor,5520000,phân khúc cận cao cấp,4.4,6,35,,https://jysk.vn/media/catalog/product/cache/2d1b3214b9b1ef59564a4bebf2c14d80/3/6/3601077-tu-ngan-keo-5-ngan-vedde-mau-soi-dam-jysk-7.jpg
JYSK_0984,tủ ngăn kéo 5 ngăn markskel gỗ công nghiệp trắng sồi rộng 52 sâu 43 cao 106cm,home decor,6320000,phân khúc cận cao cấp,4.5,57,125,,https://jysk.vn/media/catalog/product/cache/2d1b3214b9b1ef59564a4bebf2c14d80/3/6/3699010-tu-ngan-keo-5-ngan-markskel-trang-soi-jysk-14.jpg
JYSK_0985,tủ ngăn kéo 4 ngăn markskel gỗ công nghiệp trắng sồi rộng 90 sâu 44 cao 88cm,home decor,7120000,phân khúc cận cao cấp,4.0,10,5,,https://jysk.vn/media/catalog/product/cache/2d1b3214b9b1ef59564a4bebf2c14d80/3/6/3699008-tu-ngan-keo-4-ngan-markskel-trang-soi-jysk-0.jpg
JYSK_0986,tủ ngăn kéo 6 ngăn limfjorden gỗ công nghiệp màu sồi rộng 161 sâu 48 cao 79cm,home decor,7120000,phân khúc cận cao cấp,4.5,79,184,,https://jysk.vn/media/catalog/product/cache/2d1b3214b9b1ef59564a4bebf2c14d80/3/6/3670191-tu-ngan-keo-6-ngan-limfjorden-mau-soi-jysk.jpg
JYSK_0987,tủ ngăn kéo 6 ngăn limfjorden gỗ công nghiệp trắng rộng 161 sâu 48 cao 79cm,home decor,7120000,phân khúc cận cao cấp,4.1,9,42,,https://jysk.vn/media/catalog/product/cache/2d1b3214b9b1ef59564a4bebf2c14d80/3/6/3618928-tu-ngan-keo-6-ngan-limfjorden-trang-jysk.jpg
JYSK_0988,tủ ngăn kéo lintrup gỗ công nghiệp màu sồi rộng 168 sâu 41 cao 83cm,home decor,7920000,phân khúc cận cao cấp,4.8,12,308,,https://jysk.vn/media/catalog/product/cache/2d1b3214b9b1ef59564a4bebf2c14d80/3/6/3600362-tu-ngan-keo-lintrup-mau-soi-jysk-11.jpg
JYSK_0989,tủ ngăn kéo 6 ngăn odense gỗ công nghiệp đen sồi rộng 150 sâu 45 cao 85cm,home decor,8720000,phân khúc cận cao cấp,4.6,22,230,,https://jysk.vn/media/catalog/product/cache/2d1b3214b9b1ef59564a4bebf2c14d80/3/6/3670358-tu-ngan-keo-6-ngan-odense-den-soi-jysk.jpg
JYSK_0990,tủ quần áo billund gỗ công nghiệp trắng màu xi măng rộng 119 sâu 51 cao 193cm,home decor,9520000,phân khúc cận cao cấp,4.1,1,36,,https://jysk.vn/media/catalog/product/cache/2d1b3214b9b1ef59564a4bebf2c14d80/3/6/3630042-tu-quan-ao-billund-trang-mau-xi-mang-jysk.jpg
JYSK_0991,tủ quần áo ellested gỗ công nghiệp màu sồi rộng 144 sâu 50 cao 200cm,home decor,9520000,phân khúc cận cao cấp,3.8,1,20,,https://jysk.vn/media/catalog/product/cache/2d1b3214b9b1ef59564a4bebf2c14d80/3/6/3670242-tu-quan-ao-ellested-mau-soi-jysk.jpg
JYSK_0992,tủ quần áo ellested gỗ công nghiệp trắng rộng 144 sâu 50 cao 200cm,home decor,9520000,phân khúc cận cao cấp,4.2,1,35,,https://jysk.vn/media/catalog/product/cache/2d1b3214b9b1ef59564a4bebf2c14d80/3/6/3670233-tu-quan-ao-ellested-trang-jysk.jpg
JYSK_0993,tủ quần áo jenslev gỗ công nghiệp màu sồi rộng 145 sâu 50 cao 176cm,home decor,9520000,phân khúc cận cao cấp,4.3,9,26,,https://jysk.vn/media/catalog/product/cache/2d1b3214b9b1ef59564a4bebf2c14d80/3/6/3600479-tu-quan-ao-jenslev-mau-soi-jysk.jpg
JYSK_0994,tủ quần áo jenslev gỗ công nghiệp trắng rộng 144 sâu 50 cao 176cm,home decor,9520000,phân khúc cận cao cấp,3.8,8,7,,https://jysk.vn/media/catalog/product/cache/2d1b3214b9b1ef59564a4bebf2c14d80/3/6/3601404-tu-quan-ao-jenslev-trang-jysk.jpg
JYSK_0995,tủ quần áo limfjorden gỗ công nghiệp màu sồi nhạt rộng 120 sâu 58 cao 200cm,home decor,9520000,phân khúc cận cao cấp,4.3,7,41,,https://jysk.vn/media/catalog/product/cache/2d1b3214b9b1ef59564a4bebf2c14d80/3/6/3670212-tu-quan-ao-limfjorden-mau-soi-nhat-jysk.jpg
JYSK_0996,tủ quần áo limfjorden gỗ công nghiệp màu sồi rộng 120 sâu 58 cao 200cm,home decor,9520000,phân khúc cận cao cấp,4.9,24,141,,https://jysk.vn/media/catalog/product/cache/2d1b3214b9b1ef59564a4bebf2c14d80/3/6/3670213-tu-quan-ao-limfjorden-mau-soi-jysk.jpg
JYSK_0997,tủ quần áo limfjorden gỗ công nghiệp trắng rộng 120 sâu 58 cao 200cm,home decor,9520000,phân khúc cận cao cấp,4.3,7,8,,https://jysk.vn/media/catalog/product/cache/2d1b3214b9b1ef59564a4bebf2c14d80/3/6/3670214-tu-quan-ao-limfjorden-trang-jysk.jpg
JYSK_0998,tủ quần áo birkelse gỗ công nghiệp trắng sồi rộng 150 sâu 60 cao 198cm,home decor,11120000,phân khúc cao cấp,4.1,6,30,,https://jysk.vn/media/catalog/product/cache/2d1b3214b9b1ef59564a4bebf2c14d80/3/6/3672232-tu-quan-ao-birkelse-trang-soi-jysk.jpg
JYSK_0999,tủ quần áo limfjorden gỗ công nghiệp màu sồi nhạt rộng 180 sâu 58 cao 200cm,home decor,12720000,phân khúc cao cấp,4.9,48,477,,https://jysk.vn/media/catalog/product/cache/2d1b3214b9b1ef59564a4bebf2c14d80/3/6/3670215-tu-quan-ao-limfjorden-mau-soi-nhat-jysk.jpg
JYSK_1000,tủ quần áo limfjorden gỗ công nghiệp màu sồi rộng 180 sâu 58 cao 200cm,home decor,12720000,phân khúc cao cấp,4.8,75,121,,https://jysk.vn/media/catalog/product/cache/2d1b3214b9b1ef59564a4bebf2c14d80/3/6/3670216-tu-quan-ao-limfjorden-mau-soi-jysk.jpg
JYSK_1001,tủ quần áo limfjorden gỗ công nghiệp trắng rộng 180 sâu 58 cao 200cm,home decor,12720000,phân khúc cao cấp,3.8,1,41,,https://jysk.vn/media/catalog/product/cache/2d1b3214b9b1ef59564a4bebf2c14d80/3/6/3670217-tu-quan-ao-limfjorden-trang-jysk_1.jpg
JYSK_1002,tủ quần áo manderup gỗ công nghiệp màu sồi rộng 128 sâu 62 cao 199cm,home decor,13230000,phân khúc cao cấp,4.9,54,412,,https://jysk.vn/media/catalog/product/cache/2d1b3214b9b1ef59564a4bebf2c14d80/3/6/3670257-tu-quan-ao-manderup-mau-soi-jysk.jpg
JYSK_1003,tủ quần áo nautrup gỗ công nghiệp trắng sồi rộng 149 sâu 50 cao 200cm,home decor,13230000,phân khúc cao cấp,3.9,6,29,,https://jysk.vn/media/catalog/product/cache/2d1b3214b9b1ef59564a4bebf2c14d80/3/6/3670283-tu-quan-ao-nautrup-trang-soi-jysk-5.jpg
JYSK_1004,tủ quần áo vedde gỗ công nghiệp màu sồi đậm rộng 167 sâu 53 cao 197cm,home decor,14320000,phân khúc cao cấp,4.8,83,248,,https://jysk.vn/media/catalog/product/cache/2d1b3214b9b1ef59564a4bebf2c14d80/3/6/3601087-tu-quan-ao-vedde-mau-soi-dam-jysk_1.jpg
JYSK_1005,giỏ đa năng infinity nhựa pp xám rộng 13 dài 17 cao 8cm 1 4l,home decor,34300,phân khúc giá rẻ,4.8,40,415,,https://jysk.vn/media/catalog/product/cache/2d1b3214b9b1ef59564a4bebf2c14d80/4/9/4911693-gio-da-nang-infinity-xam-jysk.jpg
JYSK_1006,giỏ đa năng infinity pp trắng rộng 13 dài 17 cao 8cm,home decor,34300,phân khúc giá rẻ,4.3,1,42,,https://jysk.vn/media/catalog/product/cache/2d1b3214b9b1ef59564a4bebf2c14d80/4/9/4911691-gio-da-nang-infinity-trang-jysk.jpg
JYSK_1007,hộp đựng có nắp probox nhựa pp màu trong suốt rộng 20 dài 29 cao 10cm 3l,home decor,49500,phân khúc giá rẻ,4.6,38,452,,https://jysk.vn/media/catalog/product/cache/2d1b3214b9b1ef59564a4bebf2c14d80/4/9/4900907-hop-dung-co-nap-probox-mau-trong-suot-jysk.jpg
JYSK_1008,hộp đựng bjork giấy nén tự nhiên rộng 28 dài 17 cao 8cm,home decor,49500,phân khúc giá rẻ,4.7,99,463,,https://jysk.vn/media/catalog/product/cache/2d1b3214b9b1ef59564a4bebf2c14d80/4/9/4911306-hop-dung-bjork-tu-nhien-jysk.jpg
JYSK_1009,túi hút chân không torsten nhựa pe trong suốt rộng 60 dài 80cm,home decor,55300,phân khúc giá rẻ,4.1,2,7,,https://jysk.vn/media/catalog/product/cache/2d1b3214b9b1ef59564a4bebf2c14d80/4/9/4912308-tui-hut-chan-khong-torsten-trong-suot-jysk-2.jpg
JYSK_1010,bộ 2 túi hút chân không torsten nhựa pe trong suốt rộng 40 dài 60cm,home decor,69300,phân khúc giá rẻ,4.3,0,8,,https://jysk.vn/media/catalog/product/cache/2d1b3214b9b1ef59564a4bebf2c14d80/4/9/4912307-bo-2-tui-hut-chan-khong-torsten-trong-suot-jysk-2.jpg
JYSK_1011,giỏ đa năng infinity nhựa pp xám rộng 18 dài 26 cao 12cm 4 5l,home decor,69300,phân khúc giá rẻ,4.4,10,90,,https://jysk.vn/media/catalog/product/cache/2d1b3214b9b1ef59564a4bebf2c14d80/4/9/4962700-gio-da-nang-infinity-xam-jysk.jpg
JYSK_1012,giỏ đa năng infinity nhựa trắng rộng 18 dài 26 cao 12cm 4 5l,home decor,69300,phân khúc giá rẻ,4.1,7,39,,https://jysk.vn/media/catalog/product/cache/2d1b3214b9b1ef59564a4bebf2c14d80/4/9/4961300-gio-dung-da-nang-infinity-trang-jysk.jpg
JYSK_1013,giỏ đa năng milas nhựa pp xanh olive rộng 16 dài 25 cao 10cm,home decor,69300,phân khúc giá rẻ,3.9,7,30,,https://jysk.vn/media/catalog/product/cache/2d1b3214b9b1ef59564a4bebf2c14d80/4/9/4912644-hop-dung-milas-xanh-olive-jysk.jpg
JYSK_1014,giỏ đa năng milas nhựa pp xanh rộng 17 dài 25 cao 10cm,home decor,69300,phân khúc giá rẻ,4.6,93,451,,https://jysk.vn/media/catalog/product/cache/2d1b3214b9b1ef59564a4bebf2c14d80/4/9/4912044-hop-dung-milas-xanh-jysk.jpg
JYSK_1015,túi hút chân không torsten nhựa pe trong suốt rộng 100 dài 80cm,home decor,69300,phân khúc giá rẻ,4.4,10,46,,https://jysk.vn/media/catalog/product/cache/2d1b3214b9b1ef59564a4bebf2c14d80/4/9/4912309-tui-hut-chan-khong-torsten-trong-suot-jysk-1.jpg
JYSK_1016,bọc áo magne nhựa pe xám rộng 60 dài 150cm,home decor,74500,phân khúc giá rẻ,4.3,1,11,,https://jysk.vn/media/catalog/product/cache/2d1b3214b9b1ef59564a4bebf2c14d80/4/9/4911461-boc-ao-magne-xam-jysk-11.jpg
JYSK_1017,giỏ đa năng frans polyester giấy nén đen rộng 32 dài 27 cao 20cm,home decor,79200,phân khúc giá rẻ,3.8,3,29,,https://jysk.vn/media/catalog/product/cache/2d1b3214b9b1ef59564a4bebf2c14d80/4/9/4912352-hop-da-nang-frans-den-jysk.jpg
JYSK_1018,giỏ đa năng frans polyester giấy nén đen rộng 32 dài 28 cao 30cm,home decor,79200,phân khúc giá rẻ,4.0,2,39,,https://jysk.vn/media/catalog/product/cache/2d1b3214b9b1ef59564a4bebf2c14d80/4/9/4912357-hop-dung-frans-den-jysk.jpg
JYSK_1019,giỏ đa năng frans vải polyester giấy nén xám rộng 32 dài 27 cao 20cm,home decor,79200,phân khúc giá rẻ,4.2,7,27,,https://jysk.vn/media/catalog/product/cache/2d1b3214b9b1ef59564a4bebf2c14d80/4/9/4973301-hop-da-nang-frans-xam-jysk.jpg
JYSK_1020,hộp đa năng frans vải polyester giấy nén xám rộng 32 dài 28 cao 30cm,home decor,79200,phân khúc giá rẻ,4.6,55,396,,https://jysk.vn/media/catalog/product/cache/2d1b3214b9b1ef59564a4bebf2c14d80/4/9/4973401-hop-da-nang-frans-xam-jysk.jpg
JYSK_1021,hộp đựng có nắp basic box nhựa pp xám rộng 25 dài 33 cao 19cm 9l,home decor,84500,phân khúc giá rẻ,4.6,28,231,,https://jysk.vn/media/catalog/product/cache/2d1b3214b9b1ef59564a4bebf2c14d80/4/9/4983800-hop-dung-co-nap-basic-box-xam-jysk.jpg
